Tag,Question,ResponsesThe,"I love these little movies
What ones
The action movies you know their cartoons
oh like the batman cartoon movies
Yeah the action is very well scripted and done really well
I do think they are pretty good
I mean how often are the movies done so well
Most cartoon action movies are meh
Yeah but the batman ones are amazing
Yep most definitely",
The,Have you ever seen The Running Man?,"Yes, that is with Arnold Shwarzenegger right?-Yes, he is in that one.-He is in tons of action movies.-Ever seen Total Recall?-Of course.-He is good in that one too.-I liked him in Conan the Barbarian a lot.-Oh yeah and Conan the Destroyer.-Did you like him in Terminator 3?-Yes, but I liked him way better in part 1 and 2."
Max,I just watched Mad Max Fury road.,"How was it?-Well, it was non stop action from beginning to end.-Sounds like a good movie.-Yes it was.-Then I wanted to watch the original so i did.-Mel Gibson looked really young.-He was in the first ones.-The same director who directed road warrior directed Fury Road.-Were the styles similar?-Oh yes, and there were lots of easter eggs
I will look for them when I watch it."
Wick,John Wick 2 is a beautifully shot film.,"You're not kidding.-Tons of wide shots.-Right.-Yeah.-Great choreography.-And the editing.-The editing is particularly impressive in that there are actually a lot of long takes.-None of that crappy two second shot lengths like in a lot of action films.-Sure,  Quantum of Solace feels so long be cause it has about a  million edits in it.-It's the shortest James Bond film, but it feels like the longest.-And that's why John Wick 2 feels so great.-The action is very fluid and not chopped up.-It means you can appreciate things like the pencil scene."
music,I want you to tell me quickly what is the best action movie of all time?,"Has to be ""Crank"" hands down
No way ""John Wick""  is the best action movie ever made, just look at how many people he kills
True, but in ""Crank""  Jason Statham is killing people with his heart all messed up
Okay i'll give you that, but I would at least rank Taken a little bit higher than Crank I think Liam does a great job
Yes Liam Neeson is great in pretty much any movie he doe's and I will give you that Taken is an awesome movie
And don't forget since you obviously like Jason Statham that he also did the Transporter series
Yes those are also some killer action movies, especially when he kicks the door in.-Yeah or the fight scene in the garage where he is slipping through the oil
Oh man I forgot all about that scene"
Have,Have you seen fast five?,"Yes thats my favorite fast and furious movie
Mone too, i just love the whole movie
Same here
Its the most interesting one
Exactly, i love the ending
It was so unexpected
I couldnt believe how they traded those safes like that
Me either
It was exciting"
Jurassic,"What you think of Jurassic World
LOVED IT, what about Fast Five?","Dude Vin Desiel was a beast in it!-I know everything was just exploding in that movie
What you think about Avengers: Infinity Wars?-Super stoaked about it
ME TOO
I can't wait for Thor: Ragnarok
ME TOO MAN it's gonna be great
So many good movies coming out!"
Fiction,I watched Pulp Fiction for the first time today.,"Wow, that is a real classic cult action film.-It was nothing like what I expected.-John Travolta is brilliant in that movie.-He was like this cool contract killer, him and the other guy?-Samuel L. Jackson?-Yes!-When he recited the Bible verse, albeit a little wrongly, it was so intense.-Then ended up shooting the guy any way.-Yes!-I liked how all the stories bled into one another.-Yes, but some characters never even met.-Like Bruce Willis and Travolta, their characters never meet,"
Con,Did you ever see Con Air?,Probalby my favorite Nicholas Cage film.-That movie had everyone!-Even Dave Chapelle.-He was so funny!-Who played the main villian?-Cyrus?-Yeah.-John Malcovich.-That right!
John,We just watched John Wick 2 the other night.,"Really, is it on HBO?-No we rented the DVD.-It was great.-I loved the first one.-Well the second one is just as good.-Same people in it?-Well of course John Wick, and the man in charge of The Continental.-I like that actor, what's his name?-I think Ian McShane.-Thats him, he's a great actor."
What,What's your favorite action movie that is based on a television show?,"That would be The Fugitive.-Is that the Harrisson Ford film from the 90s?-Yep, that's the one.-That is a great film and I especially enjoyed Tommy Lee Jones's character.-I agree, he was fantastic.-Did you know that he improvised the line, ""I don't care!""?-I think I had heard that before.-It's a great line.-Let's not forget about Harrisson Ford either.-He was excellent as well.-I think he was good, but not great."
Patrick,Did you like any of Patrick Swayzes action films?,"Like Ghost?-No, that is a romance.-I mean like Point Break.-With Keanu Reeves?-That one.-I think it was a cool like surfer action one.-I liked that the bad guys were all sporty.-They were not that bad of bad guys too.-The people who were supposed to be bad had me sort of rooting for them.-I think that was just good acting on their parts."
Tag,Question,Responses
Bourne,I love the Jason Bourne franchise.,"Yeah, me too.-Matt Damon really turned the spy genre upside down with that one.-How so?-He created a spy that had human flaws and wasn't perfect.-I can see how that is true.-The first one in the series is my favorite.-Mine too.-We really get to know Matt Damon's character for the first time.-I agree and the action sequences were remarkable."
Terminator,Can't believe Terminator 2 came out 25 years ago.,"It's crazy, isn't it?-Still one of the better action movies I've ever seen.-The whole Terminator series was awesome, but T2 brought it to a whole another level.-Arnold was a complete boss in that movie.-He was overwhelmed.-The T1000 was the superior machine.-Yeah, but the T800 is no slouch.-Plus he looks like Arnold.-The rest of the series got pretty bad though.-Yeah, once James Cameron left the director's chair, it ran off the rails.-Think he'll ever get back in it?-I doubt it.-Doesn't change the fact they were great movies."
Expendables,The Expendables was an excellent movie.,"Sounds familiar, who's in it?-Sylvestor Stallone and Jason Statham.-Don't remember if I watched that one.-It's from 2010.-They were mercenaries.-Theres so many movies like that.-Yes, but not with those two in it.-True, then I guess I didn't see it.-It's an hour and fourty minutes but it goes so fast.-Lots of action with those two.-Thats why."
Face,Did you ever see Face Off?,"One of my favorites!-I know!-It was so good!-I think what was most compelling is Cage and Travolta trading off.-Yeah, they both get to play the good and bad guy.-Very cool.-And the action was super intense.-I didn't care much for the ""procedure"".-Yeah, that was a bit gross.-I'm shuddering just thinking about it!"
Cyborg,What do you think about Cyborg?,"I thought it was a terrific action flick
Did Jean-Claude Van Damme ever have a bad movie?-Never.-They were all some of the best action movies ever.-Did you like Bloodsport?-Yes, it was fantastic.-He was great in that one.-When did that one come out?-In 1988
Who directed it?-Newt Arnold."
Fall,I just saw Legends of the Fall.,"Wow, that's an oldie.-1994.
Who was in it?-Brad Pitt, Henry Thomas, Anthony Hopkins, and Julia Ormond.-She was a hottie in her time.-Who directed?-Edward Zwick.-He did The Last Samurai.-Right.-It has a cool ending, where Brad Pitt gets killed by a bear.-Cool."
music,transformers is a crap series!,"why, i like it
its crap because they do not have consistent main characters
isn't thats what makes a good movie?-the plot is pretty much the same
that is true.-they just keep fighting megatron, who just doesn't die.-that does get annoying now that you mention it.-and now on the new movie.-optimus is killing bumblebee
what?-thats not right!"
What,What type of action movies do you like?,"A combination of recent releases to those released a few years ago.-Can you give me a couple from a few years back?-RED, RED2, Slevin
What makes those your favorite?-Bruce Willis
What about more up to date?-Iron Man, Thor and The Avengers
If you could be an Avenger (from the movies) who would you want to be?-Nat..........That girl can kick A--!"
Wars,I can't wait to see the new Star Wars movie.,"What is the title going to be?-The Last Jedi.-I am assuming that Mark Hamill will be reprising his role again.-Yes, he will play Luke again, but from the trailers he seems a bit darker.-How do you mean?-The trailer shows him fearing that the Jedi's time is over with.-Well, everything must end at some point.-I hope that this isn't the last Star Wars film because the franchise is so great.-I hope so too.-There are so many memorable characters."
What,What's your favorite martial arts action flick?,"Probably any of the Ip Man trilogy.-Who stars in that?-Donnie Yen from Hong Kong.-He's incredible and super creative.-Nice, I'll check it out.-Yours?-Crouching Tiger, Hidden Dragon.-That choice means you've only seen one.-How do you know?-It's the only mass-market movie to hit American theaters."
Transformers,"Are you excited about the latest Transformers movie, The Last Knight?","Not really, Michael Bay really lost me after the second one, Revenge of the Fallen.-Revenge of the Fallen was so bad.-The action sequences were good in it and I didn't mind Shia Labeouf's constant screaming or Megan Fox's sex appeal but the heavy inclusion of his parents was too much.-I agree, the stuff with his parents and the brownies, as well as all the unnecessary scenes with the dogs were off putting.-The story line itself was a mess.-I can see why you gave up on the Transformers franchise.-Michael Bay is going to give you action but nobody has ever said he knew how to work together a good concept to present through all those explosions and crashes.-That's exactly the problem with the Transformers films.-I want to watch the films for Optimus, Bumblebee, Megatron, not for the parents or Shia's love life problems.-I can't argue about that although I think the 3rd Transformers film, Dark of the Moon was pretty decent.-Definitely a good bounce back from Revenge of the Fallen.-I haven't watched it but it has Rosie Huntington and Patrick Duffy right?-Yeah Rosie replaced Megan Fox as Sam, or Shia's love interest.-John Malkovich is also in the movie, but he plays more of a comic relief role.-I love John Malkovich especially in Being John Malkovich, and I think he's such a respectable actor that I almost watched Dark of the Moon for him but I wasn't sold because Michael Bay was directing."
Transformers,Have you heard of the new Transformers movie that's coming out?,"No I haven't, what is the name of it?-It's Transformers: The Last Knight and is directed by Michael Bay.-Awesome, I hope this one lives up to the hype from the rest of them.-Me too, the last couple of movies that Michael Bay put out have been hit or miss.-Ya but they action in them have still been good.-I have high expectations for this movie.-Why is that?-The last one that came out was a disappointment for me.-I think that Mark Wahlberg will do another good job of acting in this movie.-Michael Bay does make good movies at times.-You're right, I will go into this movie with an open mind and hopefully the movie turns out good.-Awesome!-I look forward to seeing it with you when it comes out."
Do,Do you want to go to the movies this weekend?,"Sure, what are we going to see?-I am not sure, lets look and see whats playing?-lets look for action...Oh ""Transformers: The Last Knight"" is playing
ok, if you want action, that is the right choice
I hear optimus prime is the bad guy in this
no way, how does that happen I wonder
I dont know, we will see this weekend
I cant wait
me either, I love a good action film"
Hard,I just watched Die Hard for the first time in years recently.,The break through performance that made Bruce Willis a household name.-I totally forgot the dad from the Family Matters show was in it.-Yeah he was the cop that liked to eat Twinkies.-I gotta say Die Hard was still surprising good after all this time.-If you liked Die Hard you should check out Escape from New York.-I think i remember that movie.-Is it the one with the guy that wears an eye patch.-Yup Kurt Russell played Snake Plissken in it.-Next time i have some free time i'm a check it out.-There's also a follow up called Escape from L.A that is worth seeing as well.
John,Do you ever watch John Carpenter movies?,"Sometimes.-Ghosts of Mars is one that you should watch.-It is an action movie with a slight horror twist to it.-Sounds good.-Who was in that one?-That had Jason Statham in it.-I like him.-Was it a fairly recent movie?-Yes, it came out in 2001.
Who else was in it?-Of all people Ice Cube was in it."
Hi,Hi.,"Hi.-Do you have a favorite action movie?-Hmm.-Take your time.-I would probably say Hudson Hawk.-The Bruce Willis movie?-Yeah that's the one.-You know, I've never seen it.-It's a great 80's movie."
What,What is your favorite action movie?,"My favorite action movie is probably Dirty Harry.-That's an interesting choice.-How so?-Well it's not very politically correct in these times because of all the police incidents.-I could see that point of view, but Dirty Harry never killed or hurt anyone that didn't have it coming.-That's true, he never killed an innocent person.-Yeah, Harry was just out to stop someone he knew for sure was a serial killer.-I could see how one might break the rules in that situation.-Yeah, it's somewhat easy to sympathize with Dirty Harry in that film."
Charles,DId you see any Charles Bronson Movies?,"Sure, all the ""Death Wish"" series.-Each time his wife, girlfriend or daughter was murdered and he wreaked venvence on the killers in the end.-He started out as a pacifist in the first one and his wife and daughter were killed or maimed horribly by street punks.-The first time he struck back he used two rolls of quarters in a sock as a weapon to run off a would be mugger.-That was just practice as he was looking for the creeps that had destroyed his family.-He took out quite a few bad guys along the way.-Sure, there was a couple being mugged in a parking garage and he showed up to help, killing the bad guys.-The civilians suddenly could not remember what he looked like when the cops tried to find out who he was.-In the end the cops found out who he was but he had taken out so many bad guys that the let him go by making him leave town for good.-That put him in another city to do the same thing again a few years later.-It was risky to be his wife or girlfriend, most of them were murdered by creeps!"
Suburban,You have see this movie called Suburban Commando.,"I've never heard of it.-What's it about?-Oh it's great.-Basically it is Hulk Hogan as an alien assassin being chased by other alien assassins who are also professional wrestlers.-This is starting to sound like a terrible movie.-It is!-But it is just so terrible that it happened to be great.-They obviously blew their budget on the Hulkster.-Okay, so you are saying it's kind of like Sharknado, in that it's so bad that it's kind of good?-Yeah, I mean just imagine Hulk Hogan in a cheap alien uniform escaping the Undertaker's lasers through a random suburban town.-Oh god, I don't know if I want to see this movie.-It is so worth it though.-The entire movie is cheap, the frame rate is even something like three frames per second because they run out of money.-That just sounds despicable."
Have,Have you seen the movie kingsmen?,"Yes it was a great movie
I love spy movies
Me too
And this one had lots of action and suspense
I just found out they are coming out with a new one this year
Thats awesome, when?-I read in september
I cant wait
Me either"
Day,I watched Patriot's Day this weekend.,"I didn't think it showed enough action.-Really?-I thought it was just enough.-Yes there wasn't much in the way of chases.-Well, it's based on a true story so they couldn't deviate from that much.-I understand.-I was a good movie though other than that.-I thought that it made you really reflect on these people as actual people.-Yes sometimes in movies it's hard to separate fact and fiction.-This was really someones life.-Yes and they did a great job honoring them."
What,What was the last action movie you saw?,"I think the last one I saw was the matrix.-What did you think of it?-It was pretty good.-The special effects have mostly aged well.-Yeah they were cutting edge at the time.-Absolutely.-They did some interesting and innovative things to get those 360 degree slow motion shots.-Really, what did they do?-Well they had a ton of cameras placed in a circle around the actors and they took frames from the cameras in succession.-Wow that's really interesting.-What did you think of Keanu Reeves?-He fit the part well, though his acting was a bit stiff as usual."
Lethal,We watched two Lethal Weapon movies this weekend.,"A blast from the past.-Yes, comedy and lots of action.-Mel Gibson and Danny Glover were great in those movies.-They were.-Can't picture any other actors being in those movies.-They were so young.-Joe Pesci was funny in the second one.-He was a cooky character.-They should make one in the current day.-They should.-It would still be a good movie."
Die,Which of the Die Hard movies is your favorite?,"I'm going to go ahead and actually pick a somewhat recent one.-Please, not the one in Russia.-Oh, of course not.-That was ridiculous.-Yeah, A Good Day to Die Hard was insanely awful.-Live Free or Die Hard, with Justin Long
That was pretty good, yeah.-Which was the one with the racist sign that he had to wear?-I think that was Die Hard 2.-Timely with the riots.-That was kind of stupid and disturbing but we got to meet Samuel L Jackson!"
Night,I just saw Sleepless Night.,"French movie, I believe.-Yes, directed by Frederic Jardin.-What's it about?-A French detective's son is kidnapped for cocaine.-Who stars in the movie?-Tomer Sisley.-Adel Bencherif
Tomer Sisley is hot!-Yes, he was in Angelique.-Another cool flick."
Do,Do you like action movies?,"I loved Mad Max Fury Road?-Me too.-Whose your favorite character?-Furiosa
Yeah, I can see that.-Seems like it was more about Furiosa and Immortan Joe than about Max
I just like her character as she was really strong
I liked her mechanical arm
And her shaved head
Do you think they will make another movie?-I hope so.-I love the post nuclear holocaust theme."
John,I saw a good John woo action movie last week.,"Oh yeah, which one.-The Replacement Killers.-That movie had Mia Sorvino in it.-Yes, it did.-I thought that not only was the action good, but it was well scripted.-I noticed that also.-The storyline was interesting.-You can't beat a John Woo film for action.-Yeah, it feels like you are actually in the movie when you watch it.-Hong Kong style action cinema is the best."
music,do you have a favorite action film?,"maybe enter the dragon with bruce lee.-that was good but i liked the one where he fought chuck norris.-that is epic.-i forgot about that one.-two of the best fighters ever going against each other.-yeah, and bruce knocked him out.-I guess bruce really is the better fighter.-i wish i could see a real fight between them
especially because there are so many sayings about chuck
bruce is better though"
What,What is your favorite action movie?,"I love Die Hard.-That's a great film!-Yeah, especially since it's a great Christmas movie.-Hahaha, that's so true.-What's your favorite action movie?-I'm a big fan of The Mummy actually.-Really?-What do you think about Tom Cruise being in the new one then?-I'm sad because I love Brendan Fraser.-Yeah, but I bet he'll take the action to the next level."
Max,I think Mad Max is probably the best action film in a long time.,"It's up there.-It's basically a nonstop car chase.-I was a bit disappointed that it didn't win more Oscars.-It's kind of tough for a film like that to win outside of some technical categories.-But it was very deserving.-Great performances, great direction...-But it's not really the type of movie to convince the academy.-Do they have any plans for a sequel?-Not that I've heard.-Might be a few years if it did happen.-I'll be first in line when it's released if it's released.-I'll be right there with you."
Pirates,Have you seen the new Pirates movie yet?,"Not yet.-I heard it was just okay.-That's pretty accurate.-The plot was better than some other movies.-That's what I hate about some of these movies.-They can be an incoherent mess.-This one is much simpler.-How was Johnny Depp in this one?-It was kind of weird.-He wasn't a focus as much as I thought he would be.-He is getting old, 50-something by now.-I'm not so sure they'll be another movie in the franchise.-They've milked this thing.-If there's cash to be made, expect another one."
Have,Have you ever seen undisputed 2?,"Yea, with michael jai white!-Yea, that guy is a beast.-Yea, he is so good at martial arts.-There were a lot of good fight scenes in that movie.-The best one was at the end with boyka.-Who is Boyka Played my?-Scott Adkins I think.-That guy is amazing, too.-Yea, the two of them together was an unstoppable combination."
Shoot,"If you want to watch a great movie, watch Shoot 'em Up.","Never heard of it.-Clive Owen is in it.-I like that actor.-Yes, his movies are almost always good.-Who else is in it?-Paul Giamatti.-Let me guess, he's a bad guy, right?-Of course, isn't he almost always?-Yes.-Well I like both of them, so I'll have to rent it."
What,What's a good action movie to watch?,"I just saw London Has Fallen.-I thought it was really good.-I saw Olympus Has Fallen and I liked that a lot.-Is London Has Fallen similar?-I actually thought it was better than the first one.-Is Gerard Butler back in it?-He is and he's tough as nails.-Why did you think it was better than the first?-I just thought the premise of London Has Fallen was a bit more believable.-Yeah, some parts of Olympus Has Fallen seemed a bit far fetched.-Exactly.-This one seemed much more plausible."
Raiders,Do you like Raiders of the Lost Arc?,"Yes, it is a classic Spielberg movie.-Did you know the character was named after George Lucas's dog?-No, I did not
When did it come out?-1981
Is that before Star Wars?-No, Star Wars was 1977
Are there any other Raiders movies?-Yes, quite a few actually."
Hi,Hi.,Hey there.-You into action movies?-Yeah I like them alright.-What was the last one you saw?-Could you call Guardians of the Galaxy 2 action?-Yeah I think so.-Well it was that one.-What did you think of the movie?-I thought it was pretty good.
What,What action movie has the best bank heist scene?,"That has to be Heat.-Of course, that really was a fantastic scene.-Yes, and the rest of the movie was great as well.-What did you think of the diner scene?-That was an amazing scene with two of the best American actors going toe to toe.-Yeah, that was there first scene together in any movie, correct?-Yeah, that is correct.-Who did you like better, De Niro or Pacino?-Pacino was a bit too over the top for me, so I'll choose De Niro."
Great,"I caught the movie The Great Wall the other day, have you seen it yet?","The one with Matt Damon in ancient China times right?-Yeah that's the one, it was really entertaining!-Matt Damon is such a good actor.-I love Matt Damon in the Jason Bourne Series and I was hoping this would be just as fun and it was.-I think Matt Damon brings such a charisma on to the screen.-In The Great Wall he plays a thief that ends up helping this Dynasty protect their walls from these demon monsters.-Wow, I didn't realize that film had monster elements!-I haven't watched it yet but this sounds like my type of movie.-He battles these demon monsters that are threatening to take over the world.-They repopulate really fast and are just terrifying.-It sounds like a movie Matt Damon would be pretty good in!-As long as it's action and he get's to kick butt I think the movie will be enjoyable.-Oh he certainly does kick a lot of demon monster butt.-I think you'll enjoy it the cinematography is really good and the action is tons of fun.-I'll look for The Great Wall when it comes out to add to my Matt Damon movies collection."
Schwazernager,"Arnold Schwazernager, fan?","Absolutely, how about you?-Definitely, what's your favorite Arnold movie?-Terminator 2
Oh right, that was pretty good.-A lot of cool effects.-how about you?-I liked Predator
Get to the chopper!!!-Yes, that was an iconic line
Yeah, pretty funny quote"
Ghost,Did you see Ghost Protocol?,"Yeah, that was the best Mission Impossible they've put out for a while.-I really liked Jeremy Renner.-He was good, but Simon Pegg was better.-Best little techy in the business!-Ha!-He's just so funny.-Action movies are best with a little comic reliefe.-Yeah, you need something to break up the tention.-The next chapter wasn't so great.-I hadn't seen it yet."
Eastwood,Are you into Eastwood action films?,"Like Dirty Harry?-Yes, the old school nothing but action and a bit of romance here and there.-I think he is the perfect example  of action star.-His best one may be Gran Torino.-I loved how that one followed his life, like he was still old but a really bad and cool guy.-It reminded me of his part in Sudden Impact.-The raw tuff guy you mean?-Yes, that whole action man persona he does.-His work in the Enforcer, that was action to its core."
