Tag,Question,ResponsesTransformers,"Are you excited about the latest Transformers movie, The Last Knight?","Not really, Michael Bay really lost me after the second one, Revenge of the Fallen.-Revenge of the Fallen was so bad.-The action sequences were good in it and I didn't mind Shia Labeouf's constant screaming or Megan Fox's sex appeal but the heavy inclusion of his parents was too much.-I agree, the stuff with his parents and the brownies, as well as all the unnecessary scenes with the dogs were off putting.-The story line itself was a mess.-I can see why you gave up on the Transformers franchise.-Michael Bay is going to give you action but nobody has ever said he knew how to work together a good concept to present through all those explosions and crashes.-That's exactly the problem with the Transformers films.-I want to watch the films for Optimus, Bumblebee, Megatron, not for the parents or Shia's love life problems.-I can't argue about that although I think the 3rd Transformers film, Dark of the Moon was pretty decent.-Definitely a good bounce back from Revenge of the Fallen.-I haven't watched it but it has Rosie Huntington and Patrick Duffy right?-Yeah Rosie replaced Megan Fox as Sam, or Shia's love interest.-John Malkovich is also in the movie, but he plays more of a comic relief role.-I love John Malkovich especially in Being John Malkovich, and I think he's such a respectable actor that I almost watched Dark of the Moon for him but I wasn't sold because Michael Bay was directing."
Transformers,Have you heard of the new Transformers movie that's coming out?,"No I haven't, what is the name of it?-It's Transformers: The Last Knight and is directed by Michael Bay.-Awesome, I hope this one lives up to the hype from the rest of them.-Me too, the last couple of movies that Michael Bay put out have been hit or miss.-Ya but they action in them have still been good.-I have high expectations for this movie.-Why is that?-The last one that came out was a disappointment for me.-I think that Mark Wahlberg will do another good job of acting in this movie.-Michael Bay does make good movies at times.-You're right, I will go into this movie with an open mind and hopefully the movie turns out good.-Awesome!-I look forward to seeing it with you when it comes out."
Do,Do you want to go to the movies this weekend?,"Sure, what are we going to see?-I am not sure, lets look and see whats playing?-lets look for action...Oh ""Transformers: The Last Knight"" is playing
ok, if you want action, that is the right choice
I hear optimus prime is the bad guy in this
no way, how does that happen I wonder
I dont know, we will see this weekend
I cant wait
me either, I love a good action film"
Hard,I just watched Die Hard for the first time in years recently.,The break through performance that made Bruce Willis a household name.-I totally forgot the dad from the Family Matters show was in it.-Yeah he was the cop that liked to eat Twinkies.-I gotta say Die Hard was still surprising good after all this time.-If you liked Die Hard you should check out Escape from New York.-I think i remember that movie.-Is it the one with the guy that wears an eye patch.-Yup Kurt Russell played Snake Plissken in it.-Next time i have some free time i'm a check it out.-There's also a follow up called Escape from L.A that is worth seeing as well.
John,Do you ever watch John Carpenter movies?,"Sometimes.-Ghosts of Mars is one that you should watch.-It is an action movie with a slight horror twist to it.-Sounds good.-Who was in that one?-That had Jason Statham in it.-I like him.-Was it a fairly recent movie?-Yes, it came out in 2001.
Who else was in it?-Of all people Ice Cube was in it."
Hi,Hi.,"Hi.-Do you have a favorite action movie?-Hmm.-Take your time.-I would probably say Hudson Hawk.-The Bruce Willis movie?-Yeah that's the one.-You know, I've never seen it.-It's a great 80's movie."
What,What is your favorite action movie?,"My favorite action movie is probably Dirty Harry.-That's an interesting choice.-How so?-Well it's not very politically correct in these times because of all the police incidents.-I could see that point of view, but Dirty Harry never killed or hurt anyone that didn't have it coming.-That's true, he never killed an innocent person.-Yeah, Harry was just out to stop someone he knew for sure was a serial killer.-I could see how one might break the rules in that situation.-Yeah, it's somewhat easy to sympathize with Dirty Harry in that film."
Charles,DId you see any Charles Bronson Movies?,"Sure, all the ""Death Wish"" series.-Each time his wife, girlfriend or daughter was murdered and he wreaked venvence on the killers in the end.-He started out as a pacifist in the first one and his wife and daughter were killed or maimed horribly by street punks.-The first time he struck back he used two rolls of quarters in a sock as a weapon to run off a would be mugger.-That was just practice as he was looking for the creeps that had destroyed his family.-He took out quite a few bad guys along the way.-Sure, there was a couple being mugged in a parking garage and he showed up to help, killing the bad guys.-The civilians suddenly could not remember what he looked like when the cops tried to find out who he was.-In the end the cops found out who he was but he had taken out so many bad guys that the let him go by making him leave town for good.-That put him in another city to do the same thing again a few years later.-It was risky to be his wife or girlfriend, most of them were murdered by creeps!"
Suburban,You have see this movie called Suburban Commando.,"I've never heard of it.-What's it about?-Oh it's great.-Basically it is Hulk Hogan as an alien assassin being chased by other alien assassins who are also professional wrestlers.-This is starting to sound like a terrible movie.-It is!-But it is just so terrible that it happened to be great.-They obviously blew their budget on the Hulkster.-Okay, so you are saying it's kind of like Sharknado, in that it's so bad that it's kind of good?-Yeah, I mean just imagine Hulk Hogan in a cheap alien uniform escaping the Undertaker's lasers through a random suburban town.-Oh god, I don't know if I want to see this movie.-It is so worth it though.-The entire movie is cheap, the frame rate is even something like three frames per second because they run out of money.-That just sounds despicable."
Have,Have you seen the movie kingsmen?,"Yes it was a great movie
I love spy movies
Me too
And this one had lots of action and suspense
I just found out they are coming out with a new one this year
Thats awesome, when?-I read in september
I cant wait
Me either"
Day,I watched Patriot's Day this weekend.,"I didn't think it showed enough action.-Really?-I thought it was just enough.-Yes there wasn't much in the way of chases.-Well, it's based on a true story so they couldn't deviate from that much.-I understand.-I was a good movie though other than that.-I thought that it made you really reflect on these people as actual people.-Yes sometimes in movies it's hard to separate fact and fiction.-This was really someones life.-Yes and they did a great job honoring them."
What,What was the last action movie you saw?,"I think the last one I saw was the matrix.-What did you think of it?-It was pretty good.-The special effects have mostly aged well.-Yeah they were cutting edge at the time.-Absolutely.-They did some interesting and innovative things to get those 360 degree slow motion shots.-Really, what did they do?-Well they had a ton of cameras placed in a circle around the actors and they took frames from the cameras in succession.-Wow that's really interesting.-What did you think of Keanu Reeves?-He fit the part well, though his acting was a bit stiff as usual."
Lethal,We watched two Lethal Weapon movies this weekend.,"A blast from the past.-Yes, comedy and lots of action.-Mel Gibson and Danny Glover were great in those movies.-They were.-Can't picture any other actors being in those movies.-They were so young.-Joe Pesci was funny in the second one.-He was a cooky character.-They should make one in the current day.-They should.-It would still be a good movie."
Die,Which of the Die Hard movies is your favorite?,"I'm going to go ahead and actually pick a somewhat recent one.-Please, not the one in Russia.-Oh, of course not.-That was ridiculous.-Yeah, A Good Day to Die Hard was insanely awful.-Live Free or Die Hard, with Justin Long
That was pretty good, yeah.-Which was the one with the racist sign that he had to wear?-I think that was Die Hard 2.-Timely with the riots.-That was kind of stupid and disturbing but we got to meet Samuel L Jackson!"
Night,I just saw Sleepless Night.,"French movie, I believe.-Yes, directed by Frederic Jardin.-What's it about?-A French detective's son is kidnapped for cocaine.-Who stars in the movie?-Tomer Sisley.-Adel Bencherif
Tomer Sisley is hot!-Yes, he was in Angelique.-Another cool flick."
Do,Do you like action movies?,"I loved Mad Max Fury Road?-Me too.-Whose your favorite character?-Furiosa
Yeah, I can see that.-Seems like it was more about Furiosa and Immortan Joe than about Max
I just like her character as she was really strong
I liked her mechanical arm
And her shaved head
Do you think they will make another movie?-I hope so.-I love the post nuclear holocaust theme."
John,I saw a good John woo action movie last week.,"Oh yeah, which one.-The Replacement Killers.-That movie had Mia Sorvino in it.-Yes, it did.-I thought that not only was the action good, but it was well scripted.-I noticed that also.-The storyline was interesting.-You can't beat a John Woo film for action.-Yeah, it feels like you are actually in the movie when you watch it.-Hong Kong style action cinema is the best."
music,do you have a favorite action film?,"maybe enter the dragon with bruce lee.-that was good but i liked the one where he fought chuck norris.-that is epic.-i forgot about that one.-two of the best fighters ever going against each other.-yeah, and bruce knocked him out.-I guess bruce really is the better fighter.-i wish i could see a real fight between them
especially because there are so many sayings about chuck
bruce is better though"
What,What is your favorite action movie?,"I love Die Hard.-That's a great film!-Yeah, especially since it's a great Christmas movie.-Hahaha, that's so true.-What's your favorite action movie?-I'm a big fan of The Mummy actually.-Really?-What do you think about Tom Cruise being in the new one then?-I'm sad because I love Brendan Fraser.-Yeah, but I bet he'll take the action to the next level."
Max,I think Mad Max is probably the best action film in a long time.,"It's up there.-It's basically a nonstop car chase.-I was a bit disappointed that it didn't win more Oscars.-It's kind of tough for a film like that to win outside of some technical categories.-But it was very deserving.-Great performances, great direction...-But it's not really the type of movie to convince the academy.-Do they have any plans for a sequel?-Not that I've heard.-Might be a few years if it did happen.-I'll be first in line when it's released if it's released.-I'll be right there with you."
Pirates,Have you seen the new Pirates movie yet?,"Not yet.-I heard it was just okay.-That's pretty accurate.-The plot was better than some other movies.-That's what I hate about some of these movies.-They can be an incoherent mess.-This one is much simpler.-How was Johnny Depp in this one?-It was kind of weird.-He wasn't a focus as much as I thought he would be.-He is getting old, 50-something by now.-I'm not so sure they'll be another movie in the franchise.-They've milked this thing.-If there's cash to be made, expect another one."
Have,Have you ever seen undisputed 2?,"Yea, with michael jai white!-Yea, that guy is a beast.-Yea, he is so good at martial arts.-There were a lot of good fight scenes in that movie.-The best one was at the end with boyka.-Who is Boyka Played my?-Scott Adkins I think.-That guy is amazing, too.-Yea, the two of them together was an unstoppable combination."
Shoot,"If you want to watch a great movie, watch Shoot 'em Up.","Never heard of it.-Clive Owen is in it.-I like that actor.-Yes, his movies are almost always good.-Who else is in it?-Paul Giamatti.-Let me guess, he's a bad guy, right?-Of course, isn't he almost always?-Yes.-Well I like both of them, so I'll have to rent it."
What,What's a good action movie to watch?,"I just saw London Has Fallen.-I thought it was really good.-I saw Olympus Has Fallen and I liked that a lot.-Is London Has Fallen similar?-I actually thought it was better than the first one.-Is Gerard Butler back in it?-He is and he's tough as nails.-Why did you think it was better than the first?-I just thought the premise of London Has Fallen was a bit more believable.-Yeah, some parts of Olympus Has Fallen seemed a bit far fetched.-Exactly.-This one seemed much more plausible."
Raiders,Do you like Raiders of the Lost Arc?,"Yes, it is a classic Spielberg movie.-Did you know the character was named after George Lucas's dog?-No, I did not
When did it come out?-1981
Is that before Star Wars?-No, Star Wars was 1977
Are there any other Raiders movies?-Yes, quite a few actually."
Hi,Hi.,Hey there.-You into action movies?-Yeah I like them alright.-What was the last one you saw?-Could you call Guardians of the Galaxy 2 action?-Yeah I think so.-Well it was that one.-What did you think of the movie?-I thought it was pretty good.
What,What action movie has the best bank heist scene?,"That has to be Heat.-Of course, that really was a fantastic scene.-Yes, and the rest of the movie was great as well.-What did you think of the diner scene?-That was an amazing scene with two of the best American actors going toe to toe.-Yeah, that was there first scene together in any movie, correct?-Yeah, that is correct.-Who did you like better, De Niro or Pacino?-Pacino was a bit too over the top for me, so I'll choose De Niro."
Great,"I caught the movie The Great Wall the other day, have you seen it yet?","The one with Matt Damon in ancient China times right?-Yeah that's the one, it was really entertaining!-Matt Damon is such a good actor.-I love Matt Damon in the Jason Bourne Series and I was hoping this would be just as fun and it was.-I think Matt Damon brings such a charisma on to the screen.-In The Great Wall he plays a thief that ends up helping this Dynasty protect their walls from these demon monsters.-Wow, I didn't realize that film had monster elements!-I haven't watched it yet but this sounds like my type of movie.-He battles these demon monsters that are threatening to take over the world.-They repopulate really fast and are just terrifying.-It sounds like a movie Matt Damon would be pretty good in!-As long as it's action and he get's to kick butt I think the movie will be enjoyable.-Oh he certainly does kick a lot of demon monster butt.-I think you'll enjoy it the cinematography is really good and the action is tons of fun.-I'll look for The Great Wall when it comes out to add to my Matt Damon movies collection."
Schwazernager,"Arnold Schwazernager, fan?","Absolutely, how about you?-Definitely, what's your favorite Arnold movie?-Terminator 2
Oh right, that was pretty good.-A lot of cool effects.-how about you?-I liked Predator
Get to the chopper!!!-Yes, that was an iconic line
Yeah, pretty funny quote"
Ghost,Did you see Ghost Protocol?,"Yeah, that was the best Mission Impossible they've put out for a while.-I really liked Jeremy Renner.-He was good, but Simon Pegg was better.-Best little techy in the business!-Ha!-He's just so funny.-Action movies are best with a little comic reliefe.-Yeah, you need something to break up the tention.-The next chapter wasn't so great.-I hadn't seen it yet."
Eastwood,Are you into Eastwood action films?,"Like Dirty Harry?-Yes, the old school nothing but action and a bit of romance here and there.-I think he is the perfect example  of action star.-His best one may be Gran Torino.-I loved how that one followed his life, like he was still old but a really bad and cool guy.-It reminded me of his part in Sudden Impact.-The raw tuff guy you mean?-Yes, that whole action man persona he does.-His work in the Enforcer, that was action to its core."
Snatch,Have you ever seen the movie Snatch?,That sounds like an interesting movie.-What is it about?-It is a Guy Ritchie movie about a bunch of criminals.-That sounds fun.-Why should I check it out.-It gives you a good look into the criminal underground in the United Kingdom.-Cool.-I think I might check it out.-Is anyone I know in this?-Have you heard of Brad Pitt?-Yes.-He was so good in Inglorious Bastards.-He plays a boxer in this.-Wow.-I am definitely watching this now!
What,What is your favorite type of movie?,"I am a really big fan of action movies.-Oh ya me too.-Have you seen the Rush Hour Series?-Ya it is one of my favorites.-Which one is your favorite?-I am a huge fan of the 2nd one.-Ya I like that one too.-Jackie Chan is one of my favorites.-Ya me too.-I think him and Chris Tucker work really well together.-Ya.-I like how they combine action with comedy.-Ya it gives you the best of both worlds.-Ya, they are the best duo in my opinion in regards to action movies.-The bloopers at the end are awesome too."
Last,"Do you remember  ""Last Action Hero?""","Who could forget that movie?!-It was Arnold Schwarzenegger's best role ever as far as I'm concerned.-I have to disagree with you there, I think his best role ever was ""Terminator 2: Judgement Day.""-That was a really good one, not as good as ""Last Action Hero,"" but it was really good.-I think that if they'd had more time to work on it, it would have been a lot better.-I do agree with you on that point.-The studio did them dirty.-I also think that because of that is why Arnold slowed down his acting career.-That makes sense.-I'd be pretty discouraged if I were him.-At least he came back for ""The Expendables.""-What a fantastic movie.-Yeah, I love that movie.-Totally action packed!"
Will,Do you have a favorite Will Smith action movie?,I have so many it's hard to pick just one.-I would have to say Independence Day is my all time favorite.-That is by far the highest grossing movie on his resume.-I could still watch it over and over till this day.-I think Bad Boys with Martin Lawrence might be my favorite.-Yeah that has to be one of the best buddy cop movies of all times.-Can forget the Men In Black movies.-Please i'm still waiting on the next MIB installment.-I would love to see a crossover movie with Men in Black and Guardians of the Galaxy.-So epic!
Blood,Have you seen the movie Blood Father?,"No, never heard of it.-Great movie, you have to watch it.-Who is in it?-Mel Gibson.-Wow, haven't seen one of his movies in a while.-That's what I said.-He was great in it.-Was he a cop?-No actually a convict, but won't tell you too much.-Okay, I'll check it out."
Marvin,...Marvin should have had an opinion.,"What now?-Marvin.-In Pulp Fiction.-He should have had an opinion.-That's why he died.-He didn't have an opinion.-Yeah Vincent asks him if he thought ""God came down and stopped those bullets"" and..
..and Marvin says ""man I ain't even got an opinion.""-This triggers Vincent to turn around to ask him again.-..gun in hand...casual conversation..
..""You got to have an opinion!-You think that God came down and stopped..."" Then bye bye to Marvin's Head.-...gone.-One second.-A bump in the road.-Gone.-He should have just agreed with Vincent.-Then Vincent doesn't turn around and shoot him in the face.-Yea, Marvin should have had an opinion."
Tell,Tell me what kind of action movies you like?,"Oh, I think Predator is one of my favorites.-Haha, yes!-With Arnold fighting the predator at the end.-Yup and the classic phrases like ""get to da choppa!""-But yeah, the Predator is a classic villain.-With his night vision and voice mimicking powers.-Don't forget about the optic camouflage.-Wasn't Jesse Ventura in that movie?-Yes!-He plays one of the big soldiers guys.-What a great action movie."
Yo,Yo you seen the new guardians of the galaxy?,"DUDE YES Chris Pratt was the bomb!-I loved baby groot
Eh he's over rated
Dude he's freakin adorable
You sound gay bruh
Nah he's just a cute little fella
Well I like that buff grey dude
Bruh you gay
Hey!-Forget you!"
Hi,"Hey
Hi.","Do you like action movies?-Yeah sure love them.-Do you have an all time favorite.-Point Break has got to be up there.-Oh yeah, great movie.-I haven't seen it in a while.-I saw it recently and it is still great.-Yeah I bet."
The,Have you seen The Transporter?,"Yes, it is a classic
I really like Jason Statham movies.-He seems to play the same role in each movie
Yea, he is a really good actor when it comes to action movies
He is very tough, I like it.-Being a driver like that seems to be a great fit for him.-He was also good in The Mechanic
Yea, but I liked the original version a bit more
Most originals are way better, but his version was still entertaining."
Oh,"Oh, man.","That new Mummy...-There's a new Mummy too?-Man, I haven't seen Brendan Fraser for a while.-No, man.-He's not in it.-It's... different.-He's not?-So they rebooted another reboot?-Like Spider-Man?-Yeah, I don't know why they do this.-This is really bad.-Is it the same story?-Same characters and everything?-No.-I don't... know if it's the same as those old ones, but it's not like the Brendan Fraser ones.-What is it like, then?-Well, it's got Tom Cruise as a soldier in modern-day Iraq.-And... uh, it's got Jekyll and Hyde.-What."
Transformers,Has anyone seen the new Transformers movie yet?,"It just came out the 20th of June, so I plan on seeing it Friday!-DO you know who is playing in it?-Mark Wahlberg, Anthony Hopkins, Laura Haddock, Josh Duhamel are some of the names in this summer movie.-I noticed that this movie has grossed already $260 million dollars already and its not even toward the first weekend yet!-Wow.-These guys make so much money it's nuts!-Who was the director of it?-Michael Bay directed this one, he does an amazing job with directing.-I enjoy his movies as well.-Maybe we can go see it together?"
Team,The A-Team movie was on yesterday.,"Really, I love that movie.-It was a great extension from a not so great tv show.-Liam Neeson did a great job as Hannibal.-He is a top notch actor.-The fight scenes were intense although some of the action was over the top.-I agree.-The CGI graphics were a bit much some times.-The actor who played Mr. T's role looked just like the original.-He really did look like him.-This was definitely an underrated film that didn't get much attention.-It sure didn't get any critical acclaim."
The,Do you want to come watch The Dark Knight?,"Heck yes, I love that movie!-Me too, I must have watched it one hundred times.-I was never really a fan of Heath Ledger until The Dark Knight.-I don't know, he was pretty good in ""10 Things I Hate About You.""-Are you serious right now?-Kinda.-You would say something like that.-Seriously, I agree though, his role as the Joker was awesome.-I know it was.-I've seen every Batman movie and none of them can hold a candle to this one."
What,What is a good movie about the apocalypse?,I suggest you check out Terminator 2.-I heard that movie was scary.-It is scary because it could happen.-You should face your fears though.-I will.-What happens in this movie?-A robot goes back in time to try to destroy a man who will save humanity in the future.-That makes my brain hurt!-I already have enough trouble keeping up with today.-It isn't that bad.-There is good story progression.-Will it require more than one watches?-It might.-You will catch more if you watch it again.
Gone,Did you ever see Gone In 60 Seconds?,"No, who played in that?-It was a Nicholas Cage film.-He has really gone downhill as an actor.-Yes, but this was one of his earlier works.-Was this a reboot?-Yes, the original film came out back in the 70's.-Sometimes those turn out good and sometimes not.-Well this one is worth a watch.-I'll have to check it out."
Bill,I just saw Kill Bill on demand.,"No.-1 or 2?-1.-Wasn't Sonny Chiba cool?-Yes, but i loved Darryl Hannah.-The patch made her look awesome.-Lucy Liu was great.-Uma Thurman looked fabulous.-I'm going to watch 2 tonight.-That's a great idea."
Deadpool,I just saw Deadpool and really loved it.,"I did not get to see it yet but I have heard great things about it.-There is tons of action and Marvel Comics movies are always the way to go.-Ryan Reynolds is a wonderful actor I heard he did a great job.-Oh my, he really did!-You get to fall in love with the soft side of Deadpool.-I heard that Wade gets cancer in the movie, is that true.-It is true!-I don't want to spoil too much but he has a soft side and it's really sweet that he leaves for Vanessa's sake.-Does Wade and Vanessa get married at the end?-Well, she is really upset that he left her, but she's happy to have him back at the end.-I really need to watch this movie, I think I am going to rent it tonight and indulge myself."
Hello,Hello.,"Hi.-Do you enjoy action movies?-Yeah sure.-Have a favorite?-Not really, but I do like all of the 80's action movies.-Like Robocop and all that stuff?-Yeah movies like that.-Those take me back to my childhood.-Yeah I feel the same way."
Planet,I just saw Dawn of the Planet of the Apes.,"Who is the director?-Matt Reeves.-Who plays Caesar?-Andy Serkis.-Any big name star?-Gary Oldman.-Who plays Caesar's wife, Cornelia?-Judy Greer.-She's a good actress."
